{
  "$schema": "../schemas/textbook-lesson.schema.json",
  "schemaVersion": "1.0.0",
  "id": "hsk6-v2-lesson-33",
  "lessonNumber": 33,
  "status": "review",
  "title": {
    "zh": "怀念慢生活",
    "pinyin": "huái niàn màn shēng huó",
    "vi": "Nhớ lúc sống chậm"
  },
  "themeRef": "hsk6-v2-theme-09",
  "source": {
    "pdfPages": [
      134,
      142
    ],
    "printedPages": [
      134,
      142
    ],
    "sourcePageRefs": [
      "hsk6-v2-source-page-134",
      "hsk6-v2-source-page-135",
      "hsk6-v2-source-page-136",
      "hsk6-v2-source-page-137",
      "hsk6-v2-source-page-138",
      "hsk6-v2-source-page-139",
      "hsk6-v2-source-page-140",
      "hsk6-v2-source-page-141",
      "hsk6-v2-source-page-142"
    ]
  },
  "sections": [
    {
      "type": "warmup",
      "contentRefs": [
        "hsk6-v2-l33-warmup"
      ]
    },
    {
      "type": "article",
      "contentRefs": [
        "hsk6-v2-l33-article"
      ]
    },
    {
      "type": "vocabulary",
      "contentRefs": [
        "hsk6-v2-l33-v001",
        "hsk6-v2-l33-v002",
        "hsk6-v2-l33-v003",
        "hsk6-v2-l33-v004",
        "hsk6-v2-l33-v005",
        "hsk6-v2-l33-v006",
        "hsk6-v2-l33-v007",
        "hsk6-v2-l33-v008",
        "hsk6-v2-l33-v009",
        "hsk6-v2-l33-v010",
        "hsk6-v2-l33-v011",
        "hsk6-v2-l33-v012",
        "hsk6-v2-l33-v013",
        "hsk6-v2-l33-v014",
        "hsk6-v2-l33-v015",
        "hsk6-v2-l33-v016",
        "hsk6-v2-l33-v017",
        "hsk6-v2-l33-v018",
        "hsk6-v2-l33-v019",
        "hsk6-v2-l33-v020",
        "hsk6-v2-l33-v021",
        "hsk6-v2-l33-v022",
        "hsk6-v2-l33-v023",
        "hsk6-v2-l33-v024",
        "hsk6-v2-l33-v025",
        "hsk6-v2-l33-v026",
        "hsk6-v2-l33-v027",
        "hsk6-v2-l33-v028",
        "hsk6-v2-l33-v029",
        "hsk6-v2-l33-v030",
        "hsk6-v2-l33-v031",
        "hsk6-v2-l33-v032",
        "hsk6-v2-l33-v033",
        "hsk6-v2-l33-v034",
        "hsk6-v2-l33-v035",
        "hsk6-v2-l33-v036",
        "hsk6-v2-l33-v037",
        "hsk6-v2-l33-v038",
        "hsk6-v2-l33-v039",
        "hsk6-v2-l33-v040",
        "hsk6-v2-l33-v041",
        "hsk6-v2-l33-v042",
        "hsk6-v2-l33-v043",
        "hsk6-v2-l33-v044",
        "hsk6-v2-l33-v045",
        "hsk6-v2-l33-v046",
        "hsk6-v2-l33-v047",
        "hsk6-v2-l33-v048",
        "hsk6-v2-l33-v049",
        "hsk6-v2-l33-v050",
        "hsk6-v2-l33-v051",
        "hsk6-v2-l33-v052",
        "hsk6-v2-l33-v053",
        "hsk6-v2-l33-v054",
        "hsk6-v2-l33-v055",
        "hsk6-v2-l33-v056"
      ]
    },
    {
      "type": "integrated-notes",
      "contentRefs": [
        "hsk6-v2-l33-integrated-notes"
      ],
      "languagePointRefs": [
        "hsk6-v2-l33-lp-01",
        "hsk6-v2-l33-lp-02"
      ]
    },
    {
      "type": "word-distinction",
      "contentRefs": [
        "hsk6-v2-l33-word-distinction"
      ],
      "languagePointRefs": [
        "hsk6-v2-l33-lp-03"
      ]
    },
    {
      "type": "discourse-rhetoric",
      "contentRefs": [
        "hsk6-v2-l33-discourse-rhetoric"
      ],
      "languagePointRefs": [
        "hsk6-v2-l33-lp-04"
      ]
    },
    {
      "type": "practice",
      "contentRefs": [
        "hsk6-v2-l33-practice"
      ]
    },
    {
      "type": "extension",
      "contentRefs": [
        "hsk6-v2-l33-extension"
      ],
      "languagePointRefs": [
        "hsk6-v2-l33-lp-05"
      ]
    }
  ],
  "editorial": {
    "publicationReady": false,
    "articleOcrStatus": "review",
    "vocabularyOcrStatus": "review",
    "answerStatus": "not-structured",
    "requiredActions": [
      "Đối chiếu OCR bài khóa và nghĩa tiếng Việt với PDF.",
      "Rà lại số thứ tự từ mới bị OCR bỏ sót.",
      "Bổ sung các file MP3 theo mã track nếu có quyền sử dụng."
    ]
  }
}
